{
  "show_id": "demo-show",
  "name": "Demo Show",
  "version": "0.1.0",
  "created_at": "2026-03-03T00:00:00Z",
  "updated_at": "2026-03-03T13:21:07Z",
  "default_scene_id": "scene-intro",
  "scenes": [
    {
      "scene_id": "scene-intro",
      "file": "scenes/scene-intro.json"
    }
  ],
  "actions": [
    {
      "action_id": "action-fly-in",
      "file": "actions/action-fly-in.json"
    }
  ],
  "metadata": {
    "author": "operator",
    "notes": "Starter template"
  }
}
